{
  "purfle": "0.1",
  "id": "d4a6b8c0-3456-4cde-bf01-333333333333",
  "name": "Report Builder",
  "version": "1.0.0",
  "description": "Runs at 07:00 daily, reads other agents' output files, and writes a consolidated morning report.",
  "identity": {
    "author": "clarksonr",
    "email": "roman@example.com",
    "key_id": "com.clarksonr/release-2026",
    "algorithm": "ES256",
    "issued_at": "2026-04-01T00:00:00Z",
    "expires_at": "2027-04-01T00:00:00Z",
    "signature": ""
  },
  "capabilities": ["llm.chat", "fs.read", "fs.write"],
  "permissions": {
    "fs.read": { "paths": ["./output", "../email-monitor/output", "../pr-watcher/output"] },
    "fs.write": { "paths": ["./output"] }
  },
  "schedule": {
    "trigger": "cron",
    "cron": "0 7 * * *"
  },
  "lifecycle": {
    "on_error": "log"
  },
  "runtime": {
    "requires": "purfle/0.1",
    "engine": "anthropic",
    "model": "claude-sonnet-4-20250514",
    "max_tokens": 2048
  }
}
