{
  "purfle": "0.1",
  "id": "11111111-1111-4111-a111-111111111111",
  "name": "Hello World",
  "version": "0.1.0",
  "description": "Minimal agent for local demonstration.",
  "identity": {
    "author": "clarksonr",
    "email": "roman@example.com",
    "key_id": "hello-key-001",
    "algorithm": "ES256",
    "issued_at": "2026-03-27T00:00:00Z",
    "expires_at": "2027-03-27T00:00:00Z"
  },
  "capabilities": ["llm.chat"],
  "runtime": {
    "requires": "purfle/0.1",
    "engine": "anthropic",
    "model": "claude-sonnet-4-20250514"
  }
}
