{
  "purfle": "0.1",
  "id": "c3f5a7b9-2345-4bcd-aef0-222222222222",
  "name": "PR Watcher",
  "version": "1.0.0",
  "description": "Checks GitHub every 30 minutes for new pull requests and summarizes them.",
  "identity": {
    "author": "clarksonr",
    "email": "roman@example.com",
    "key_id": "com.clarksonr/release-2026",
    "algorithm": "ES256",
    "issued_at": "2026-04-01T00:00:00Z",
    "expires_at": "2027-04-01T00:00:00Z",
    "signature": "eyJhbGciOiJFUzI1NiIsImtpZCI6ImNvbS5jbGFya3NvbnIvcmVsZWFzZS0yMDI2In0.eyJjYXBhYmlsaXRpZXMiOlsibGxtLmNoYXQiLCJuZXR3b3JrLm91dGJvdW5kIiwiZnMud3JpdGUiXSwiZGVzY3JpcHRpb24iOiJDaGVja3MgR2l0SHViIGV2ZXJ5IDMwIG1pbnV0ZXMgZm9yIG5ldyBwdWxsIHJlcXVlc3RzIGFuZCBzdW1tYXJpemVzIHRoZW0uIiwiaWQiOiJjM2Y1YTdiOS0yMzQ1LTRiY2QtYWVmMC0yMjIyMjIyMjIyMjIiLCJpZGVudGl0eSI6eyJhbGdvcml0aG0iOiJFUzI1NiIsImF1dGhvciI6ImNsYXJrc29uciIsImVtYWlsIjoicm9tYW5AZXhhbXBsZS5jb20iLCJleHBpcmVzX2F0IjoiMjAyNy0wNC0wMVQwMDowMDowMFoiLCJpc3N1ZWRfYXQiOiIyMDI2LTA0LTAxVDAwOjAwOjAwWiIsImtleV9pZCI6ImNvbS5jbGFya3NvbnIvcmVsZWFzZS0yMDI2In0sImxpZmVjeWNsZSI6eyJvbl9lcnJvciI6ImxvZyJ9LCJuYW1lIjoiUFIgV2F0Y2hlciIsInBlcm1pc3Npb25zIjp7ImZzLndyaXRlIjp7InBhdGhzIjpbIi4vb3V0cHV0Il19LCJuZXR3b3JrLm91dGJvdW5kIjp7Imhvc3RzIjpbImxvY2FsaG9zdDo4MTExIiwiYXBpLmdpdGh1Yi5jb20iXX19LCJwdXJmbGUiOiIwLjEiLCJydW50aW1lIjp7ImVuZ2luZSI6ImFudGhyb3BpYyIsIm1heF90b2tlbnMiOjEwMjQsIm1vZGVsIjoiY2xhdWRlLXNvbm5ldC00LTIwMjUwNTE0IiwicmVxdWlyZXMiOiJwdXJmbGUvMC4xIn0sInNjaGVkdWxlIjp7ImludGVydmFsX21pbnV0ZXMiOjMwLCJ0cmlnZ2VyIjoiaW50ZXJ2YWwifSwidG9vbHMiOlt7ImRlc2NyaXB0aW9uIjoiTGlzdCBwdWxsIHJlcXVlc3RzIGZyb20gYSBHaXRIdWIgcmVwb3NpdG9yeSAocGFyYW1zOiBvd25lciwgcmVwbywgc3RhdGUpIiwibmFtZSI6Imxpc3RfcHVsbF9yZXF1ZXN0cyIsInNlcnZlciI6Imh0dHA6Ly9sb2NhbGhvc3Q6ODExMSJ9LHsiZGVzY3JpcHRpb24iOiJHZXQgcHVsbCByZXF1ZXN0IGRldGFpbHMgaW5jbHVkaW5nIGRpZmYgc3RhdHMgKHBhcmFtczogb3duZXIsIHJlcG8sIG51bWJlcikiLCJuYW1lIjoiZ2V0X3B1bGxfcmVxdWVzdCIsInNlcnZlciI6Imh0dHA6Ly9sb2NhbGhvc3Q6ODExMSJ9LHsiZGVzY3JpcHRpb24iOiJMaXN0IHJldmlld3MgZm9yIGEgcHVsbCByZXF1ZXN0IChwYXJhbXM6IG93bmVyLCByZXBvLCBudW1iZXIpIiwibmFtZSI6Imxpc3RfcmV2aWV3cyIsInNlcnZlciI6Imh0dHA6Ly9sb2NhbGhvc3Q6ODExMSJ9XSwidmVyc2lvbiI6IjEuMC4wIn0.2ymD8UY20Xt3ZxTPcUEi-HpUMDt9r4poe0SWI0zjgzCzeq05Vuokx0CS4iejmiBmlyqYPcxGaXiznQLZ5J-FvA"
  },
  "capabilities": [
    "llm.chat",
    "network.outbound",
    "fs.write"
  ],
  "permissions": {
    "network.outbound": {
      "hosts": [
        "localhost:8111",
        "api.github.com"
      ]
    },
    "fs.write": {
      "paths": [
        "./output"
      ]
    }
  },
  "schedule": {
    "trigger": "interval",
    "interval_minutes": 30
  },
  "lifecycle": {
    "on_error": "log"
  },
  "runtime": {
    "requires": "purfle/0.1",
    "engine": "anthropic",
    "model": "claude-sonnet-4-20250514",
    "max_tokens": 1024
  },
  "tools": [
    {
      "name": "list_pull_requests",
      "server": "http://localhost:8111",
      "description": "List pull requests from a GitHub repository (params: owner, repo, state)"
    },
    {
      "name": "get_pull_request",
      "server": "http://localhost:8111",
      "description": "Get pull request details including diff stats (params: owner, repo, number)"
    },
    {
      "name": "list_reviews",
      "server": "http://localhost:8111",
      "description": "List reviews for a pull request (params: owner, repo, number)"
    }
  ]
}
