{
  "purfle": "0.1",
  "id": "11111111-1111-4111-a111-111111111111",
  "name": "Hello World",
  "version": "0.1.0",
  "description": "Minimal agent for local demonstration.",
  "identity": {
    "author": "clarksonr",
    "email": "roman@example.com",
    "key_id": "com.clarksonr/release-2026",
    "algorithm": "ES256",
    "issued_at": "2026-03-27T00:00:00Z",
    "expires_at": "2027-03-27T00:00:00Z",
    "signature": "eyJhbGciOiJFUzI1NiIsImtpZCI6ImNvbS5jbGFya3NvbnIvcmVsZWFzZS0yMDI2In0.eyJjYXBhYmlsaXRpZXMiOlsibGxtLmNoYXQiXSwiZGVzY3JpcHRpb24iOiJNaW5pbWFsIGFnZW50IGZvciBsb2NhbCBkZW1vbnN0cmF0aW9uLiIsImlkIjoiMTExMTExMTEtMTExMS00MTExLWExMTEtMTExMTExMTExMTExIiwiaWRlbnRpdHkiOnsiYWxnb3JpdGhtIjoiRVMyNTYiLCJhdXRob3IiOiJjbGFya3NvbnIiLCJlbWFpbCI6InJvbWFuQGV4YW1wbGUuY29tIiwiZXhwaXJlc19hdCI6IjIwMjctMDMtMjdUMDA6MDA6MDBaIiwiaXNzdWVkX2F0IjoiMjAyNi0wMy0yN1QwMDowMDowMFoiLCJrZXlfaWQiOiJjb20uY2xhcmtzb25yL3JlbGVhc2UtMjAyNiJ9LCJuYW1lIjoiSGVsbG8gV29ybGQiLCJwdXJmbGUiOiIwLjEiLCJydW50aW1lIjp7ImVuZ2luZSI6ImFudGhyb3BpYyIsIm1vZGVsIjoiY2xhdWRlLXNvbm5ldC00LTIwMjUwNTE0IiwicmVxdWlyZXMiOiJwdXJmbGUvMC4xIn0sInZlcnNpb24iOiIwLjEuMCJ9.tzPypFY7dLF-wXzEKGtmG4ajNU0-wSDPxUpBh3tSoN9jj42xj0XLeC7RUtAZ5kfISmnTVvKr5EhAFwKUmuHnzw"
  },
  "capabilities": [
    "llm.chat"
  ],
  "runtime": {
    "requires": "purfle/0.1",
    "engine": "anthropic",
    "model": "claude-sonnet-4-20250514"
  }
}
